{
  "$schema": "https://json-schema.org/draft/2020-12/schema",
  "$id": "https://github.com/pixel-agents-hq/pixel-index/packages/layout-core/schema/layout.schema.json",
  "title": "Pixel Agents office layout",
  "description": "Structural shape of an exported Pixel Agents layout. Upstream treats the layout as an opaque object owned by the rendering layer, so this schema covers the invariants the index depends on rather than every field. Cross-field and upstream-dependent rules (tiles length, known furniture ids, layoutRevision, grid bounds) cannot be expressed here and are enforced by validateLayout() in @pixel-index/layout-core.",
  "type": "object",
  "required": ["version", "cols", "rows", "tiles", "furniture"],
  "properties": {
    "version": {
      "const": 1,
      "description": "Layout format version. Only 1 exists so far."
    },
    "layoutRevision": {
      "type": "integer",
      "minimum": 0,
      "description": "Pixel Agents discards a stored layout when the bundled default's revision is HIGHER than this. A layout published below the current revision will be wiped on the user's next start."
    },
    "cols": { "type": "integer", "minimum": 1, "maximum": 64 },
    "rows": { "type": "integer", "minimum": 1, "maximum": 64 },
    "tiles": {
      "type": "array",
      "items": { "type": "integer" },
      "description": "Row-major tile types, length cols * rows."
    },
    "tileColors": {
      "type": "array",
      "description": "Per-tile colour values, parallel to tiles. Null where a tile is uncoloured."
    },
    "furniture": {
      "type": "array",
      "items": {
        "type": "object",
        "required": ["type", "col", "row"],
        "properties": {
          "type": { "type": "string" },
          "col": { "type": "integer", "minimum": 0 },
          "row": {
            "type": "integer",
            "description": "May be negative. Wall-mounted furniture is anchored by its BOTTOM row (editorActions.ts getWallPlacementRow: row - (footprintH - 1)), so a tall item on the top wall legitimately sits above row 0. The real lower bound depends on the item's footprint and canPlaceOnWalls, which only validateLayout() can check."
          }
        }
      }
    },
    "carpets": { "type": "array" },
    "areas": {
      "type": "array",
      "items": {
        "type": "object",
        "required": ["label"],
        "properties": {
          "label": { "type": "string" },
          "color": { "type": "string" }
        }
      }
    },
    "areaTiles": { "type": "array" },
    "pets": { "type": "array" }
  }
}
