{"version":1,"cols":21,"rows":22,"layoutRevision":1,"tiles":[255,255,255,255,255,255,255,255,255,255,255,255,255,255,255,255,255,255,255,255,255,255,255,255,255,255,255,255,255,255,255,255,255,255,255,255,255,255,255,255,255,255,255,255,255,255,255,255,255,255,255,255,255,255,255,255,255,255,255,255,255,255,255,255,255,255,255,255,255,255,255,255,255,255,255,255,255,255,255,255,255,255,255,255,255,255,255,255,255,255,255,255,255,255,255,255,255,255,255,255,255,255,255,255,255,255,255,255,255,255,255,255,255,255,255,255,255,255,255,255,255,255,255,255,255,255,255,255,255,255,255,255,255,255,255,255,255,255,255,255,255,255,255,255,255,255,255,255,255,255,255,255,255,255,255,255,255,255,255,255,255,255,255,255,255,255,255,255,255,255,255,255,255,255,255,255,255,255,255,255,255,255,255,255,255,255,255,255,255,255,255,255,255,255,255,255,255,255,255,255,255,255,255,255,255,255,255,255,255,255,0,0,0,0,0,0,0,0,0,0,0,0,0,0,0,0,0,0,0,0,255,0,7,7,7,7,7,7,7,7,7,0,1,1,1,1,1,1,1,1,0,255,0,7,7,7,7,7,7,7,7,7,0,1,1,1,1,1,1,1,1,0,255,0,7,7,7,7,7,7,7,7,7,0,1,1,1,1,1,1,1,1,0,255,0,7,7,7,7,7,7,7,7,7,1,1,1,1,1,1,1,1,1,0,255,0,7,7,7,7,7,7,7,7,7,1,1,1,1,1,1,1,1,1,0,255,0,7,7,7,7,7,7,7,7,7,1,1,1,1,1,1,1,1,1,0,255,0,7,7,7,7,7,7,7,7,7,1,1,1,1,1,1,1,1,1,0,255,0,7,7,7,7,7,7,7,7,7,0,1,1,1,1,1,1,1,1,0,255,0,7,7,7,7,7,7,7,7,7,0,9,9,9,9,9,9,9,9,0,255,0,7,7,7,7,7,7,7,7,7,0,9,9,9,9,9,9,9,9,0,255,255,255,255,255,255,255,255,255,255,255,255,255,255,255,255,255,255,255,255,255,255],"tileColors":[null,null,null,null,null,null,null,null,null,null,null,null,null,null,null,null,null,null,null,null,null,null,null,null,null,null,null,null,null,null,null,null,null,null,null,null,null,null,null,null,null,null,null,null,null,null,null,null,null,null,null,null,null,null,null,null,null,null,null,null,null,null,null,null,null,null,null,null,null,null,null,null,null,null,null,null,null,null,null,null,null,null,null,null,null,null,null,null,null,null,null,null,null,null,null,null,null,null,null,null,null,null,null,null,null,null,null,null,null,null,null,null,null,null,null,null,null,null,null,null,null,null,null,null,null,null,null,null,null,null,null,null,null,null,null,null,null,null,null,null,null,null,null,null,null,null,null,null,null,null,null,null,null,null,null,null,null,null,null,null,null,null,null,null,null,null,null,null,null,null,null,null,null,null,null,null,null,null,null,null,null,null,null,null,null,null,null,null,null,null,null,null,null,null,null,null,null,null,null,null,null,null,null,null,null,null,null,null,null,null,{"h":214,"s":30,"b":-100,"c":-55},{"h":214,"s":30,"b":-100,"c":-55},{"h":214,"s":30,"b":-100,"c":-55},{"h":214,"s":30,"b":-100,"c":-55},{"h":214,"s":30,"b":-100,"c":-55},{"h":214,"s":30,"b":-100,"c":-55},{"h":214,"s":30,"b":-100,"c":-55},{"h":214,"s":30,"b":-100,"c":-55},{"h":214,"s":30,"b":-100,"c":-55},{"h":214,"s":30,"b":-100,"c":-55},{"h":214,"s":30,"b":-100,"c":-55},{"h":214,"s":30,"b":-100,"c":-55},{"h":214,"s":30,"b":-100,"c":-55},{"h":214,"s":30,"b":-100,"c":-55},{"h":214,"s":30,"b":-100,"c":-55},{"h":214,"s":30,"b":-100,"c":-55},{"h":214,"s":30,"b":-100,"c":-55},{"h":214,"s":30,"b":-100,"c":-55},{"h":214,"s":30,"b":-100,"c":-55},{"h":214,"s":30,"b":-100,"c":-55},null,{"h":214,"s":30,"b":-100,"c":-55},{"h":25,"s":48,"b":-43,"c":-88},{"h":25,"s":48,"b":-43,"c":-88},{"h":25,"s":48,"b":-43,"c":-88},{"h":25,"s":48,"b":-43,"c":-88},{"h":25,"s":48,"b":-43,"c":-88},{"h":25,"s":48,"b":-43,"c":-88},{"h":25,"s":48,"b":-43,"c":-88},{"h":25,"s":48,"b":-43,"c":-88},{"h":25,"s":48,"b":-43,"c":-88},{"h":214,"s":30,"b":-100,"c":-55},{"h":209,"s":39,"b":-25,"c":-80},{"h":209,"s":39,"b":-25,"c":-80},{"h":209,"s":39,"b":-25,"c":-80},{"h":209,"s":39,"b":-25,"c":-80},{"h":209,"s":39,"b":-25,"c":-80},{"h":209,"s":39,"b":-25,"c":-80},{"h":209,"s":39,"b":-25,"c":-80},{"h":209,"s":39,"b":-25,"c":-80},{"h":214,"s":30,"b":-100,"c":-55},null,{"h":214,"s":30,"b":-100,"c":-55},{"h":25,"s":48,"b":-43,"c":-88},{"h":25,"s":48,"b":-43,"c":-88},{"h":25,"s":48,"b":-43,"c":-88},{"h":25,"s":48,"b":-43,"c":-88},{"h":25,"s":48,"b":-43,"c":-88},{"h":25,"s":48,"b":-43,"c":-88},{"h":25,"s":48,"b":-43,"c":-88},{"h":25,"s":48,"b":-43,"c":-88},{"h":25,"s":48,"b":-43,"c":-88},{"h":214,"s":30,"b":-100,"c":-55},{"h":209,"s":39,"b":-25,"c":-80},{"h":209,"s":39,"b":-25,"c":-80},{"h":209,"s":39,"b":-25,"c":-80},{"h":209,"s":39,"b":-25,"c":-80},{"h":209,"s":39,"b":-25,"c":-80},{"h":209,"s":39,"b":-25,"c":-80},{"h":209,"s":39,"b":-25,"c":-80},{"h":209,"s":39,"b":-25,"c":-80},{"h":214,"s":30,"b":-100,"c":-55},null,{"h":214,"s":30,"b":-100,"c":-55},{"h":25,"s":48,"b":-43,"c":-88},{"h":25,"s":48,"b":-43,"c":-88},{"h":25,"s":48,"b":-43,"c":-88},{"h":25,"s":48,"b":-43,"c":-88},{"h":25,"s":48,"b":-43,"c":-88},{"h":25,"s":48,"b":-43,"c":-88},{"h":25,"s":48,"b":-43,"c":-88},{"h":25,"s":48,"b":-43,"c":-88},{"h":25,"s":48,"b":-43,"c":-88},{"h":214,"s":30,"b":-100,"c":-55},{"h":209,"s":39,"b":-25,"c":-80},{"h":209,"s":39,"b":-25,"c":-80},{"h":209,"s":39,"b":-25,"c":-80},{"h":209,"s":39,"b":-25,"c":-80},{"h":209,"s":39,"b":-25,"c":-80},{"h":209,"s":39,"b":-25,"c":-80},{"h":209,"s":39,"b":-25,"c":-80},{"h":209,"s":39,"b":-25,"c":-80},{"h":214,"s":30,"b":-100,"c":-55},null,{"h":214,"s":30,"b":-100,"c":-55},{"h":25,"s":48,"b":-43,"c":-88},{"h":25,"s":48,"b":-43,"c":-88},{"h":25,"s":48,"b":-43,"c":-88},{"h":25,"s":48,"b":-43,"c":-88},{"h":25,"s":48,"b":-43,"c":-88},{"h":25,"s":48,"b":-43,"c":-88},{"h":25,"s":48,"b":-43,"c":-88},{"h":25,"s":48,"b":-43,"c":-88},{"h":25,"s":48,"b":-43,"c":-88},{"h":209,"s":39,"b":-25,"c":-80},{"h":209,"s":39,"b":-25,"c":-80},{"h":209,"s":39,"b":-25,"c":-80},{"h":209,"s":39,"b":-25,"c":-80},{"h":209,"s":39,"b":-25,"c":-80},{"h":209,"s":39,"b":-25,"c":-80},{"h":209,"s":39,"b":-25,"c":-80},{"h":209,"s":39,"b":-25,"c":-80},{"h":209,"s":39,"b":-25,"c":-80},{"h":214,"s":30,"b":-100,"c":-55},null,{"h":214,"s":30,"b":-100,"c":-55},{"h":25,"s":48,"b":-43,"c":-88},{"h":25,"s":48,"b":-43,"c":-88},{"h":25,"s":48,"b":-43,"c":-88},{"h":25,"s":48,"b":-43,"c":-88},{"h":25,"s":48,"b":-43,"c":-88},{"h":25,"s":48,"b":-43,"c":-88},{"h":25,"s":48,"b":-43,"c":-88},{"h":25,"s":48,"b":-43,"c":-88},{"h":25,"s":48,"b":-43,"c":-88},{"h":209,"s":39,"b":-25,"c":-80},{"h":209,"s":39,"b":-25,"c":-80},{"h":209,"s":39,"b":-25,"c":-80},{"h":209,"s":39,"b":-25,"c":-80},{"h":209,"s":39,"b":-25,"c":-80},{"h":209,"s":39,"b":-25,"c":-80},{"h":209,"s":39,"b":-25,"c":-80},{"h":209,"s":39,"b":-25,"c":-80},{"h":209,"s":39,"b":-25,"c":-80},{"h":214,"s":30,"b":-100,"c":-55},null,{"h":214,"s":30,"b":-100,"c":-55},{"h":25,"s":48,"b":-43,"c":-88},{"h":25,"s":48,"b":-43,"c":-88},{"h":25,"s":48,"b":-43,"c":-88},{"h":25,"s":48,"b":-43,"c":-88},{"h":25,"s":48,"b":-43,"c":-88},{"h":25,"s":48,"b":-43,"c":-88},{"h":25,"s":48,"b":-43,"c":-88},{"h":25,"s":48,"b":-43,"c":-88},{"h":25,"s":48,"b":-43,"c":-88},{"h":209,"s":39,"b":-25,"c":-80},{"h":209,"s":39,"b":-25,"c":-80},{"h":209,"s":39,"b":-25,"c":-80},{"h":209,"s":39,"b":-25,"c":-80},{"h":209,"s":39,"b":-25,"c":-80},{"h":209,"s":39,"b":-25,"c":-80},{"h":209,"s":39,"b":-25,"c":-80},{"h":209,"s":39,"b":-25,"c":-80},{"h":209,"s":39,"b":-25,"c":-80},{"h":214,"s":30,"b":-100,"c":-55},null,{"h":214,"s":30,"b":-100,"c":-55},{"h":25,"s":48,"b":-43,"c":-88},{"h":25,"s":48,"b":-43,"c":-88},{"h":25,"s":48,"b":-43,"c":-88},{"h":25,"s":48,"b":-43,"c":-88},{"h":25,"s":48,"b":-43,"c":-88},{"h":25,"s":48,"b":-43,"c":-88},{"h":25,"s":48,"b":-43,"c":-88},{"h":25,"s":48,"b":-43,"c":-88},{"h":25,"s":48,"b":-43,"c":-88},{"h":209,"s":39,"b":-25,"c":-80},{"h":209,"s":39,"b":-25,"c":-80},{"h":209,"s":39,"b":-25,"c":-80},{"h":209,"s":39,"b":-25,"c":-80},{"h":209,"s":39,"b":-25,"c":-80},{"h":209,"s":39,"b":-25,"c":-80},{"h":209,"s":39,"b":-25,"c":-80},{"h":209,"s":39,"b":-25,"c":-80},{"h":209,"s":39,"b":-25,"c":-80},{"h":214,"s":30,"b":-100,"c":-55},null,{"h":214,"s":30,"b":-100,"c":-55},{"h":25,"s":48,"b":-43,"c":-88},{"h":25,"s":48,"b":-43,"c":-88},{"h":25,"s":48,"b":-43,"c":-88},{"h":25,"s":48,"b":-43,"c":-88},{"h":25,"s":48,"b":-43,"c":-88},{"h":25,"s":48,"b":-43,"c":-88},{"h":25,"s":48,"b":-43,"c":-88},{"h":25,"s":48,"b":-43,"c":-88},{"h":25,"s":48,"b":-43,"c":-88},{"h":214,"s":30,"b":-100,"c":-55},{"h":209,"s":39,"b":-25,"c":-80},{"h":209,"s":39,"b":-25,"c":-80},{"h":209,"s":39,"b":-25,"c":-80},{"h":209,"s":39,"b":-25,"c":-80},{"h":209,"s":39,"b":-25,"c":-80},{"h":209,"s":39,"b":-25,"c":-80},{"h":209,"s":39,"b":-25,"c":-80},{"h":209,"s":39,"b":-25,"c":-80},{"h":214,"s":30,"b":-100,"c":-55},null,{"h":214,"s":30,"b":-100,"c":-55},{"h":25,"s":48,"b":-43,"c":-88},{"h":25,"s":48,"b":-43,"c":-88},{"h":25,"s":48,"b":-43,"c":-88},{"h":25,"s":48,"b":-43,"c":-88},{"h":25,"s":48,"b":-43,"c":-88},{"h":25,"s":48,"b":-43,"c":-88},{"h":25,"s":48,"b":-43,"c":-88},{"h":25,"s":48,"b":-43,"c":-88},{"h":25,"s":48,"b":-43,"c":-88},{"h":214,"s":30,"b":-100,"c":-55},{"h":209,"s":0,"b":-16,"c":-8},{"h":209,"s":0,"b":-16,"c":-8},{"h":209,"s":0,"b":-16,"c":-8},{"h":209,"s":0,"b":-16,"c":-8},{"h":209,"s":0,"b":-16,"c":-8},{"h":209,"s":0,"b":-16,"c":-8},{"h":209,"s":0,"b":-16,"c":-8},{"h":209,"s":0,"b":-16,"c":-8},{"h":214,"s":30,"b":-100,"c":-55},null,{"h":214,"s":30,"b":-100,"c":-55},{"h":25,"s":48,"b":-43,"c":-88},{"h":25,"s":48,"b":-43,"c":-88},{"h":25,"s":48,"b":-43,"c":-88},{"h":25,"s":48,"b":-43,"c":-88},{"h":25,"s":48,"b":-43,"c":-88},{"h":25,"s":48,"b":-43,"c":-88},{"h":25,"s":48,"b":-43,"c":-88},{"h":25,"s":48,"b":-43,"c":-88},{"h":25,"s":48,"b":-43,"c":-88},{"h":214,"s":30,"b":-100,"c":-55},{"h":209,"s":0,"b":-16,"c":-8},{"h":209,"s":0,"b":-16,"c":-8},{"h":209,"s":0,"b":-16,"c":-8},{"h":209,"s":0,"b":-16,"c":-8},{"h":209,"s":0,"b":-16,"c":-8},{"h":209,"s":0,"b":-16,"c":-8},{"h":209,"s":0,"b":-16,"c":-8},{"h":209,"s":0,"b":-16,"c":-8},{"h":214,"s":30,"b":-100,"c":-55},null,null,null,null,null,null,null,null,null,null,null,null,null,null,null,null,null,null,null,null,null,null],"furniture":[{"uid":"f-1773353910654-5cdg","type":"TABLE_FRONT","col":4,"row":16},{"uid":"f-1773354646615-jhxl","type":"C